{
  "version": 1,
  "question": "Show me the relationship between user 42 and companies Acme, Globex, and Initech based on their transactions",
  "connection": "demo",
  "nodes": [
    { "id": "user:42", "type": "user", "label": "Dana Reyes", "sourceTable": "users", "pk": 42 },
    { "id": "company:1", "type": "company", "label": "Acme Corp", "sourceTable": "companies", "pk": 1 },
    { "id": "company:2", "type": "company", "label": "Globex", "sourceTable": "companies", "pk": 2 },
    { "id": "company:3", "type": "company", "label": "Initech", "sourceTable": "companies", "pk": 3 }
  ],
  "edges": [
    {
      "id": "e-acme",
      "source": "user:42",
      "target": "company:1",
      "label": "$48,200.00 · 17 txns",
      "weight": 17,
      "receipt": {
        "sql": "SELECT t.id, t.amount, t.created_at\nFROM transactions t\nJOIN accounts a ON a.id = t.account_id\nJOIN companies c ON c.id = t.company_id\nWHERE a.user_id = $1\n  AND c.name = $2\nORDER BY t.created_at DESC",
        "params": [42, "Acme Corp"],
        "rowCount": 17,
        "sampledRows": [
          { "id": "9201", "amount": "2800.00", "created_at": "2026-06-28" },
          { "id": "9188", "amount": "2800.00", "created_at": "2026-06-14" },
          { "id": "9154", "amount": "2800.00", "created_at": "2026-05-30" },
          { "id": "9120", "amount": "2800.00", "created_at": "2026-05-15" }
        ],
        "joinPath": ["transactions", "accounts", "companies"],
        "ranAt": "2026-07-10T14:02:09Z",
        "durationMs": 41
      }
    },
    {
      "id": "e-globex",
      "source": "user:42",
      "target": "company:2",
      "label": "$9,850.00 · 4 txns",
      "weight": 4,
      "receipt": {
        "sql": "SELECT t.id, t.amount, t.created_at\nFROM transactions t\nJOIN accounts a ON a.id = t.account_id\nJOIN companies c ON c.id = t.company_id\nWHERE a.user_id = $1\n  AND c.name = $2\nORDER BY t.created_at DESC",
        "params": [42, "Globex"],
        "rowCount": 4,
        "sampledRows": [
          { "id": "9107", "amount": "4200.00", "created_at": "2026-06-30" },
          { "id": "8841", "amount": "2150.00", "created_at": "2026-05-12" },
          { "id": "8512", "amount": "1900.00", "created_at": "2026-03-02" },
          { "id": "8320", "amount": "1600.00", "created_at": "2026-01-19" }
        ],
        "joinPath": ["transactions", "accounts", "companies"],
        "ranAt": "2026-07-10T14:02:11Z",
        "durationMs": 38
      }
    },
    {
      "id": "e-initech",
      "source": "user:42",
      "target": "company:3",
      "label": "$310.00 · 1 txn",
      "weight": 1,
      "receipt": {
        "sql": "SELECT t.id, t.amount, t.created_at\nFROM transactions t\nJOIN accounts a ON a.id = t.account_id\nJOIN companies c ON c.id = t.company_id\nWHERE a.user_id = $1\n  AND c.name = $2\nORDER BY t.created_at DESC",
        "params": [42, "Initech"],
        "rowCount": 1,
        "sampledRows": [
          { "id": "8888", "amount": "310.00", "created_at": "2026-04-02" }
        ],
        "joinPath": ["transactions", "accounts", "companies"],
        "ranAt": "2026-07-10T14:02:12Z",
        "durationMs": 22
      }
    }
  ]
}
